Role,Task,Currently Automated by AI
Frontend Developer,Designing responsive UI layouts,No
Frontend Developer,"Writing modular and reusable HTML, CSS, and JavaScript code",No
Frontend Developer,Debugging browser compatibility issues,Partially
Frontend Developer,Ensuring accessibility compliance,No
Frontend Developer,Integrating UI designs from tools like Figma,No
Frontend Developer,Creating animations and transitions,No
Frontend Developer,Optimizing front-end performance,No
Frontend Developer,Implementing client-side validations,No
Frontend Developer,Collaborating with UX/UI designers,No
Frontend Developer,Testing frontend applications on multiple devices,No
Frontend Developer,Writing style guides for UI components,No
Frontend Developer,Managing state using Redux,No
Frontend Developer,Using browser developer tools for debugging,Partially
Frontend Developer,Applying SEO optimizations,No
Frontend Developer,Implementing WebSocket connections,No
Frontend Developer,Using APIs to fetch and display data,No
Frontend Developer,Debugging rendering issues,Partially
Frontend Developer,Migrating older designs to modern frameworks,No
Frontend Developer,Maintaining frontend documentation,No
Frontend Developer,Integrating third-party libraries,No
Frontend Developer,Building Progressive Web Apps (PWAs),No
Frontend Developer,Conducting user feedback sessions,No
Frontend Developer,Implementing dark mode features,No
Frontend Developer,Testing and implementing A/B tests,No
Frontend Developer,Managing static assets like images and fonts,No
Frontend Developer,Optimizing front-end assets using Webpack,No
Frontend Developer,Implementing localization for multi-language support,No
Frontend Developer,Ensuring pixel-perfect UI designs,No
Frontend Developer,Keeping up with frontend framework updates,No
Frontend Developer,Writing unit tests for UI components,No
Backend Developer,Designing and developing server-side logic,No
Backend Developer,Writing secure APIs,No
Backend Developer,Implementing authentication and authorization mechanisms,No
Backend Developer,Managing database connections,No
Backend Developer,Writing efficient queries for relational databases,No
Backend Developer,Debugging server errors,Partially
Backend Developer,Configuring middleware for request handling,Partially
Backend Developer,Optimizing server-side performance,No
Backend Developer,Developing microservices,No
Backend Developer,Implementing caching mechanisms,No
Backend Developer,Writing data models and schemas,No
Backend Developer,Configuring file upload handlers,Partially
Backend Developer,Managing API rate limiting,No
Backend Developer,Handling asynchronous tasks,No
Backend Developer,Writing server logs for debugging,Partially
Backend Developer,Implementing email notifications from the server,No
Backend Developer,Setting up and maintaining session management,No
Backend Developer,Managing third-party API integrations,No
Backend Developer,Developing WebSocket-based communication,No
Backend Developer,Implementing data validation at the backend,No
Backend Developer,Writing backend unit tests,No
Backend Developer,Setting up application-level monitoring,No
Backend Developer,Managing cloud-based server deployments,No
Backend Developer,Debugging slow server response times,Partially
Backend Developer,Setting up and managing CI/CD pipelines,No
Backend Developer,Migrating databases,No
Backend Developer,Writing scripts for scheduled tasks,No
Backend Developer,Configuring and maintaining load balancers,Partially
Backend Developer,Handling error reporting tools,No
Backend Developer,Documenting backend endpoints,No
Full-Stack Developer,Designing end-to-end application architecture,No
Full-Stack Developer,Writing both frontend and backend code,No
Full-Stack Developer,Ensuring data consistency between frontend and backend,Partially
Full-Stack Developer,Implementing dynamic forms that interact with APIs,Partially
Full-Stack Developer,Debugging issues across the stack,Partially
Full-Stack Developer,Maintaining code repositories,No
Full-Stack Developer,Handling server deployments,Partially
Full-Stack Developer,Creating reusable components for frontend and backend,No
Full-Stack Developer,Managing user sessions end-to-end,Partially
Full-Stack Developer,Integrating payment gateways,Partially
Full-Stack Developer,Setting up logging mechanisms across the stack,Partially
Full-Stack Developer,Writing integration tests,Partially
Full-Stack Developer,Optimizing database queries for better UI responsiveness,Partially
Full-Stack Developer,Debugging API errors and response issues,Partially
Full-Stack Developer,Configuring domain settings and SSL certificates,Partially
Full-Stack Developer,Implementing real-time features,Partially
Full-Stack Developer,Building features for role-based access control,No
Full-Stack Developer,Managing shared state between frontend and backend,Partially
Full-Stack Developer,Writing comprehensive application documentation,No
Full-Stack Developer,Developing secure data storage mechanisms,No
Full-Stack Developer,Monitoring server performance,Partially
Full-Stack Developer,Configuring client-side error reporting,Partially
Full-Stack Developer,Setting up third-party integrations end-to-end,Partially
Full-Stack Developer,Conducting code reviews for both layers,No
Full-Stack Developer,Optimizing frontend assets on server-side rendering,Partially
Full-Stack Developer,Troubleshooting cross-origin resource sharing (CORS) issues,Partially
Full-Stack Developer,Writing reusable templates,No
Full-Stack Developer,Creating multi-tenant application features,No
Full-Stack Developer,Managing deployment pipelines for full-stack projects,Partially
Full-Stack Developer,Keeping both frontend and backend updated with new frameworks,No
Mobile Application Developer,Designing mobile-friendly user interfaces,No
Mobile Application Developer,Developing cross-platform applications using tools like Flutter or React Native,Partially
Mobile Application Developer,Implementing device-specific features like GPS and camera integration,Partially
Mobile Application Developer,Debugging app crashes using logs from mobile devices,Partially
Mobile Application Developer,Optimizing app performance for low-resource devices,Partially
Mobile Application Developer,Publishing apps on Google Play Store and Apple App Store,Partially
Mobile Application Developer,Writing secure storage mechanisms for sensitive data,No
Mobile Application Developer,Implementing push notification features,Partially
Mobile Application Developer,Testing applications on different screen sizes and resolutions,Partially
Mobile Application Developer,"Managing app lifecycle states (e.g., foreground, background)",No
Mobile Application Developer,Using analytics tools like Firebase for app insights,Partially
Mobile Application Developer,Writing platform-specific code for advanced features,No
Mobile Application Developer,Integrating social media APIs,Partially
Mobile Application Developer,Developing offline-first features using local storage,Partially
Mobile Application Developer,Setting up in-app purchases and subscriptions,Partially
Mobile Application Developer,Implementing biometric authentication,No
Mobile Application Developer,Managing app permissions dynamically,Partially
Mobile Application Developer,Debugging network-related issues,Partially
Mobile Application Developer,Building UI animations for mobile interactions,No
Mobile Application Developer,Implementing app versioning and update mechanisms,Partially
Mobile Application Developer,Writing unit and integration tests for mobile apps,Partially
Mobile Application Developer,Using simulators/emulators for testing,Partially
Mobile Application Developer,Configuring mobile app CI/CD pipelines,Partially
Mobile Application Developer,Managing dependencies using tools like Gradle or CocoaPods,Partially
Mobile Application Developer,Developing custom widgets/components,No
Mobile Application Developer,Resolving memory leaks and optimizing resource usage,Partially
Mobile Application Developer,Ensuring compliance with app store guidelines,No
Mobile Application Developer,Implementing deep linking for app navigation,Partially
Mobile Application Developer,Handling app data synchronization with cloud services,Partially
Mobile Application Developer,Collaborating with backend teams for API requirements,No
Game Developer,Designing game mechanics and rules,No
Game Developer,Building 2D/3D environments using game engines like Unity,Partially
Game Developer,Writing shaders for rendering effects,No
Game Developer,Developing character movement and AI behaviors,Partially
Game Developer,Optimizing game performance for various platforms,Partially
Game Developer,Creating particle effects for dynamic visuals,No
Game Developer,Testing gameplay for bugs and improvements,Partially
Game Developer,Implementing multiplayer networking features,Partially
Game Developer,Writing scripts for game logic and events,No
Game Developer,Creating in-game physics simulations,Partially
Game Developer,Designing user interfaces for games,No
Game Developer,Integrating in-app purchases or ads,Partially
Game Developer,"Managing asset pipelines for textures, models, and audio",Partially
Game Developer,Writing procedural content generation algorithms,No
Game Developer,Creating audio-visual synchronization,No
Game Developer,Debugging frame rate issues,Partially
Game Developer,Developing level progression systems,No
Game Developer,Testing cross-platform compatibility,Partially
Game Developer,Writing tools for in-house game development,No
Game Developer,Implementing cloud saves for player data,Partially
Game Developer,Designing game tutorials or onboarding flows,No
Game Developer,Collaborating with designers for gameplay adjustments,No
Game Developer,Writing AI algorithms for NPCs,Partially
Game Developer,Optimizing graphics for mobile devices,Partially
Game Developer,Developing virtual reality (VR) or augmented reality (AR) features,Partially
Game Developer,Debugging collision and hit detection issues,Partially
Game Developer,Implementing leaderboards and achievements,Partially
Game Developer,Writing game analytics for player behavior insights,Partially
Game Developer,Implementing anti-cheat mechanisms,Partially
Game Developer,Conducting playtesting sessions and collecting feedback,No
QA Engineer,Designing test cases based on user requirements,No
QA Engineer,Executing manual testing of software features,Partially
QA Engineer,Identifying and reporting software bugs,Partially
QA Engineer,Writing test plans for new product releases,No
QA Engineer,Performing regression testing after bug fixes,Partially
QA Engineer,Validating software against business requirements,No
QA Engineer,Conducting cross-browser testing,Partially
QA Engineer,Performing load and stress testing,Partially
QA Engineer,Testing API endpoints for functionality,Partially
QA Engineer,Validating database updates during testing,No
QA Engineer,Tracking bugs using tools like JIRA,Partially
QA Engineer,Writing test scripts for automation frameworks,Partially
QA Engineer,Testing mobile app functionality on various devices,Partially
QA Engineer,Conducting usability testing,No
QA Engineer,Ensuring compliance with software accessibility standards,No
QA Engineer,Setting up test environments,Partially
QA Engineer,Performing integration testing for interconnected systems,Partially
QA Engineer,Analyzing software logs for issues,Partially
QA Engineer,Creating test data for specific scenarios,No
QA Engineer,Participating in sprint planning meetings,No
QA Engineer,Performing security testing for vulnerabilities,Partially
QA Engineer,Testing software compatibility with third-party tools,Partially
QA Engineer,Validating installation processes,No
QA Engineer,Monitoring system behavior during peak loads,Partially
QA Engineer,Writing detailed bug reports,No
QA Engineer,Reviewing software documentation for accuracy,No
QA Engineer,Verifying resolved issues,No
QA Engineer,Conducting exploratory testing,No
QA Engineer,Writing performance metrics for tests,No
QA Engineer,Providing test summary reports to stakeholders,No
DevOps Engineer,Setting up CI/CD pipelines,Partially
DevOps Engineer,Automating infrastructure provisioning with tools like Terraform,Partially
DevOps Engineer,Configuring containerization using Docker,Partially
DevOps Engineer,Managing Kubernetes clusters,Partially
DevOps Engineer,Monitoring application performance using tools like Prometheus,Partially
DevOps Engineer,Ensuring high availability of applications,Partially
DevOps Engineer,Writing shell scripts for task automation,No
DevOps Engineer,Implementing load balancing for distributed systems,Partially
DevOps Engineer,Managing version control systems like Git,No
DevOps Engineer,Debugging deployment issues,Partially
DevOps Engineer,Setting up infrastructure as code (IaC) practices,Partially
DevOps Engineer,"Managing cloud services on AWS, Azure, or GCP",Partially
DevOps Engineer,Automating application deployments,Partially
DevOps Engineer,Implementing logging and monitoring tools,Partially
DevOps Engineer,Performing incident response and root cause analysis,No
DevOps Engineer,Managing server scaling during peak loads,Partially
DevOps Engineer,Setting up application monitoring dashboards,Partially
DevOps Engineer,Conducting regular security checks for infrastructure,Partially
DevOps Engineer,Managing backup and disaster recovery plans,No
DevOps Engineer,Troubleshooting system downtimes,Partially
DevOps Engineer,Writing playbooks for operational procedures,No
DevOps Engineer,Configuring network settings for cloud resources,Partially
DevOps Engineer,Implementing rolling updates and rollbacks,Partially
DevOps Engineer,Maintaining database backups and restores,No
DevOps Engineer,Configuring service mesh architectures,Partially
DevOps Engineer,Optimizing cloud resource costs,Partially
DevOps Engineer,Managing API gateway configurations,Partially
DevOps Engineer,Implementing blue-green deployments,Partially
DevOps Engineer,Setting up network firewalls and security groups,Partially
DevOps Engineer,Documenting infrastructure configurations,No
Site Reliability Engineer,Developing scripts for system automation,Partially
Site Reliability Engineer,Monitoring system uptime and availability,Partially
Site Reliability Engineer,Performing root cause analysis for outages,No
Site Reliability Engineer,Managing incident response protocols,No
Site Reliability Engineer,Setting up system alerts using tools like PagerDuty,Partially
Site Reliability Engineer,Writing postmortem reports after incidents,No
Site Reliability Engineer,Optimizing server performance and resource usage,Partially
Site Reliability Engineer,Automating routine maintenance tasks,Partially
Site Reliability Engineer,Collaborating with development teams for reliability improvements,No
Site Reliability Engineer,Testing failover and disaster recovery mechanisms,No
Site Reliability Engineer,Managing distributed tracing for debugging performance issues,Partially
Site Reliability Engineer,Setting up dashboards for monitoring,Partially
Site Reliability Engineer,Managing SLA (Service Level Agreement) metrics,No
Site Reliability Engineer,Configuring autoscaling for cloud systems,Partially
Site Reliability Engineer,Debugging database performance bottlenecks,Partially
Site Reliability Engineer,Writing custom monitoring plugins,No
Site Reliability Engineer,Handling service capacity planning,No
Site Reliability Engineer,Ensuring secure data transfer protocols,Partially
Site Reliability Engineer,Managing log aggregation systems,Partially
Site Reliability Engineer,Testing network latency across regions,Partially
Site Reliability Engineer,Optimizing application deployment times,Partially
Site Reliability Engineer,Implementing chaos engineering practices,No
Site Reliability Engineer,Performing system backups and recovery tests,No
Site Reliability Engineer,Managing certificates and key rotations,Partially
Site Reliability Engineer,Automating release rollbacks during failures,Partially
Site Reliability Engineer,Conducting regular security assessments,Partially
Site Reliability Engineer,Building tools to improve developer productivity,No
Site Reliability Engineer,Debugging API gateway performance issues,Partially
Site Reliability Engineer,Validating software releases against performance metrics,No
Site Reliability Engineer,Maintaining up-to-date incident documentation,No
Data Engineer,"Designing ETL (Extract, Transform, Load) pipelines",Partially
Data Engineer,Building data warehouses using platforms like Snowflake,Partially
Data Engineer,Writing SQL queries for data extraction,Partially
Data Engineer,Managing real-time data ingestion using tools like Kafka,Partially
Data Engineer,Debugging pipeline failures,Partially
Data Engineer,Developing data validation checks,Partially
Data Engineer,Implementing data deduplication processes,Partially
Data Engineer,Optimizing database performance,Partially
Data Engineer,Creating data transformation scripts in Python or Scala,No
Data Engineer,Managing data lake architectures,No
Data Engineer,Integrating APIs for external data sources,Partially
Data Engineer,Automating pipeline monitoring systems,Partially
Data Engineer,Writing unit tests for data workflows,Partially
Data Engineer,Setting up data versioning systems,Partially
Data Engineer,Ensuring data pipeline scalability,Partially
Data Engineer,Managing schema changes for evolving data needs,Partially
Data Engineer,Implementing data governance policies,No
Data Engineer,Creating data lineage documentation,No
Data Engineer,Monitoring pipeline latency metrics,Partially
Data Engineer,Handling sensitive data encryption,No
Data Engineer,Writing scripts for ad hoc data extraction,No
Data Engineer,Debugging cloud storage issues,Partially
Data Engineer,Setting up data streaming frameworks,Partially
Data Engineer,Documenting pipeline workflows for stakeholders,No
Data Engineer,Managing cloud-based storage costs,Partially
Data Engineer,Ensuring compliance with data regulations like GDPR,No
Data Engineer,Building APIs for data access,Partially
Data Engineer,Validating data accuracy in production systems,Partially
Data Engineer,Collaborating with data scientists for model-ready datasets,No
Data Engineer,Implementing error-handling mechanisms in pipelines,Partially
Machine Learning Engineer,Preprocessing datasets for machine learning models,Partially
Machine Learning Engineer,Training ML models using TensorFlow or PyTorch,Partially
Machine Learning Engineer,Debugging model convergence issues,No
Machine Learning Engineer,Writing feature extraction pipelines,Partially
Machine Learning Engineer,Tuning hyperparameters for optimal model performance,Partially
Machine Learning Engineer,Managing model deployment in production environments,Partially
Machine Learning Engineer,Creating real-time prediction APIs,Partially
Machine Learning Engineer,Evaluating model accuracy and precision metrics,Partially
Machine Learning Engineer,Implementing model explainability techniques,No
Machine Learning Engineer,Debugging GPU resource utilization issues,No
Machine Learning Engineer,Automating model retraining workflows,Partially
Machine Learning Engineer,Using cloud ML services for scalability,Partially
Machine Learning Engineer,Developing custom loss functions for models,No
Machine Learning Engineer,Handling imbalanced datasets,Partially
Machine Learning Engineer,Documenting model architectures for teams,No
Machine Learning Engineer,Managing ML pipeline orchestration tools like Kubeflow,Partially
Machine Learning Engineer,Deploying models with serverless architecture,Partially
Machine Learning Engineer,Writing custom ML evaluation scripts,No
Machine Learning Engineer,Optimizing models for edge devices,Partially
Machine Learning Engineer,Validating model predictions with stakeholders,No
Machine Learning Engineer,Building data augmentation pipelines,Partially
Machine Learning Engineer,Conducting model drift analysis,No
Machine Learning Engineer,Managing model versioning systems,Partially
Machine Learning Engineer,Collaborating with data engineers for data requirements,No
Machine Learning Engineer,Conducting performance benchmarking for models,No
Machine Learning Engineer,Writing end-to-end ML workflows,No
Machine Learning Engineer,Debugging issues in multi-model ensembles,No
Machine Learning Engineer,Implementing transfer learning techniques,Partially
Machine Learning Engineer,Writing detailed user guides for ML applications,No
Machine Learning Engineer,Ensuring compliance with ethical AI guidelines,No
Cloud Engineer,Configuring virtual machines in cloud environments,Partially
Cloud Engineer,Managing cloud storage services like S3 or Azure Blob,Partially
Cloud Engineer,Setting up virtual private networks (VPNs),Partially
Cloud Engineer,Deploying applications on serverless platforms,Partially
Cloud Engineer,Configuring IAM roles for secure access,Partially
Cloud Engineer,Setting up auto-scaling groups for applications,Partially
Cloud Engineer,Debugging cloud resource connectivity issues,Partially
Cloud Engineer,Managing cloud billing and cost optimizations,Partially
Cloud Engineer,Creating cloud infrastructure using IaC tools,Partially
Cloud Engineer,Configuring API gateways for microservices,Partially
Cloud Engineer,Writing backup and restore scripts for cloud resources,No
Cloud Engineer,Deploying containerized applications,Partially
Cloud Engineer,Setting up logging and monitoring for cloud resources,Partially
Cloud Engineer,Configuring CDNs for improved content delivery,Partially
Cloud Engineer,Managing DNS settings in cloud environments,Partially
Cloud Engineer,Implementing disaster recovery strategies,No
Cloud Engineer,Writing cloud policy configurations,No
Cloud Engineer,Optimizing cloud databases for performance,Partially
Cloud Engineer,Setting up hybrid cloud solutions,No
Cloud Engineer,Testing multi-region failover configurations,No
Cloud Engineer,Managing encrypted cloud data transfers,Partially
Cloud Engineer,Writing detailed cloud architecture diagrams,No
Cloud Engineer,Automating deployments with CI/CD pipelines,Partially
Cloud Engineer,Implementing zero-downtime deployments,Partially
Cloud Engineer,Troubleshooting cloud API rate limits,Partially
Cloud Engineer,Ensuring regulatory compliance in cloud setups,No
Cloud Engineer,Collaborating with developers for cloud-ready applications,No
Cloud Engineer,Writing scripts to monitor cloud resource utilization,No
Cloud Engineer,Migrating on-premise applications to the cloud,Partially
Cloud Engineer,Reviewing and updating cloud security policies,No
Technical Lead,Reviewing code contributions for quality and adherence to standards,No
Technical Lead,Designing high-level architecture for new projects,No
Technical Lead,Leading technical discussions during sprint planning,No
Technical Lead,Mentoring junior developers on best practices,No
Technical Lead,Evaluating new tools and technologies for team adoption,No
Technical Lead,Debugging complex system issues that span multiple components,Partially
Technical Lead,Writing technical documentation for critical modules,No
Technical Lead,Collaborating with product managers to define technical requirements,No
Technical Lead,Planning and assigning development tasks to team members,No
Technical Lead,Monitoring codebase health and addressing technical debt,No
Technical Lead,Ensuring consistent usage of coding patterns across the team,No
Technical Lead,Prototyping solutions for high-risk features,No
Technical Lead,Managing cross-team technical dependencies,No
Technical Lead,Conducting regular one-on-one meetings with team members,No
Technical Lead,Analyzing performance bottlenecks and recommending improvements,Partially
Technical Lead,Designing database schemas for scalable applications,No
Technical Lead,Reviewing CI/CD pipeline configurations for efficiency,Partially
Technical Lead,Preparing presentations for technical demos or reviews,No
Technical Lead,Collaborating with stakeholders to resolve conflicting requirements,No
Technical Lead,Conducting root cause analysis for major incidents,Partially
Technical Lead,Organizing team-wide training sessions,No
Technical Lead,Participating in hiring interviews for technical roles,No
Technical Lead,Balancing short-term delivery goals with long-term technical strategies,No
Technical Lead,Researching industry trends and keeping the team updated,No
Technical Lead,Setting up processes for incident management,No
Technical Lead,Resolving merge conflicts during code reviews,Partially
Technical Lead,Auditing third-party dependencies for security risks,Partially
Technical Lead,Approving architectural changes proposed by team members,No
Technical Lead,Facilitating retrospectives to address technical challenges,No
Technical Lead,Documenting lessons learned from project implementations,No
Security Engineer,Performing penetration testing on applications and networks,Partially
Security Engineer,Writing secure authentication mechanisms,No
Security Engineer,Conducting threat modeling for applications,No
Security Engineer,Managing vulnerability scans and prioritizing issues,Partially
Security Engineer,Implementing encryption for sensitive data,No
Security Engineer,Monitoring systems for suspicious activities,Partially
Security Engineer,Debugging firewall configurations,Partially
Security Engineer,Writing intrusion detection rules,No
Security Engineer,Managing public and private keys for secure communication,No
Security Engineer,Setting up two-factor authentication systems,No
