Security Engineer,Validating third-party libraries for security risks,Partially
Security Engineer,Conducting regular security awareness training sessions,No
Security Engineer,Implementing secure API communication protocols,No
Security Engineer,Reviewing application logs for unusual patterns,Partially
Security Engineer,Managing security patches across systems,Partially
Security Engineer,Developing security policies for the organization,No
Security Engineer,Debugging cloud security misconfigurations,Partially
Security Engineer,Writing scripts to automate security monitoring tasks,Partially
Security Engineer,Designing secure architecture for new systems,No
Security Engineer,Auditing compliance with standards like GDPR or PCI DSS,No
Security Engineer,Responding to incidents and preparing forensic reports,No
Security Engineer,Testing system backups for ransomware recovery,No
Security Engineer,Evaluating the security posture of vendors,No
Security Engineer,Managing access control systems,Partially
Security Engineer,Performing static and dynamic code analysis,Partially
Security Engineer,Writing secure session management mechanisms,No
Security Engineer,Reviewing deployment pipelines for security gaps,Partially
Security Engineer,Debugging web application vulnerabilities like XSS or CSRF,Partially
Security Engineer,Collaborating with legal teams for breach response,No
Security Engineer,Conducting red team exercises to test system defenses,No
Database Administrator,Managing database performance tuning,Partially
Database Administrator,Writing complex SQL queries for reporting,Partially
Database Administrator,Monitoring database usage and optimizing indexes,Partially
Database Administrator,Configuring database backups and recovery plans,Partially
Database Administrator,Debugging slow-running queries,Partially
Database Administrator,Designing database schemas for new applications,No
Database Administrator,Managing database security policies,No
Database Administrator,Upgrading and patching database software,Partially
Database Administrator,Ensuring high availability through replication,Partially
Database Administrator,Monitoring database server health,Partially
Database Administrator,Writing stored procedures for business logic,No
Database Administrator,Debugging data corruption issues,No
Database Administrator,Managing database access permissions,No
Database Administrator,Setting up data archiving strategies,Partially
Database Administrator,Migrating databases between servers,Partially
Database Administrator,Auditing database activity for compliance,No
Database Administrator,Configuring clustering for fault tolerance,Partially
Database Administrator,Writing automated scripts for maintenance tasks,Partially
Database Administrator,Implementing partitioning strategies for large datasets,Partially
Database Administrator,Debugging deadlock issues,Partially
Database Administrator,Monitoring database growth and forecasting needs,Partially
Database Administrator,Documenting database configurations,No
Database Administrator,Resolving connectivity issues between applications and databases,Partially
Database Administrator,Implementing encryption for sensitive data,No
Database Administrator,Performing database normalization and denormalization,No
Database Administrator,Writing ETL processes for data transformation,Partially
Database Administrator,Validating data integrity across systems,Partially
Database Administrator,Optimizing database for read-heavy or write-heavy loads,Partially
Database Administrator,Managing legacy database systems,Partially
Database Administrator,Collaborating with developers for query optimization,No
Solution Architect,Designing end-to-end solutions for complex projects,No
Solution Architect,Analyzing business requirements to propose technical architectures,No
Solution Architect,Evaluating existing systems for scalability and integration potential,No
Solution Architect,Preparing high-level design documents,No
Solution Architect,Selecting technology stacks based on project needs,No
Solution Architect,Creating proof-of-concept implementations for critical components,Partially
Solution Architect,Collaborating with product managers to refine requirements,No
Solution Architect,Presenting architectural recommendations to stakeholders,No
Solution Architect,Managing system interoperability with third-party solutions,No
Solution Architect,Identifying risks and proposing mitigation strategies,No
Solution Architect,Evaluating cloud platforms for deployment strategies,Partially
Solution Architect,Conducting technical feasibility studies,No
Solution Architect,Defining data flow between systems,No
Solution Architect,Managing technical constraints like latency and storage,No
Solution Architect,Reviewing project plans for alignment with architectural goals,No
Solution Architect,Auditing codebases for adherence to architectural guidelines,Partially
Solution Architect,Designing secure access mechanisms for system integrations,No
Solution Architect,Managing API contracts between microservices,No
Solution Architect,Identifying opportunities for automation within workflows,No
Solution Architect,Writing detailed documentation for proposed solutions,No
Solution Architect,Reviewing and approving significant system changes,No
Solution Architect,Estimating cost and resource requirements for projects,No
Solution Architect,Analyzing trade-offs between performance and cost,No
Solution Architect,Leading workshops to explain architectures to teams,No
Solution Architect,Managing communication between technical and non-technical stakeholders,No
Solution Architect,Proposing modernization strategies for legacy systems,No
Solution Architect,Reviewing compliance with organizational policies,No
Solution Architect,Monitoring implementation progress to align with architecture,No
Solution Architect,Identifying and eliminating single points of failure in designs,No
Solution Architect,Keeping up with emerging technologies and trends,No
Data Scientist,Collecting raw data from various sources,Partially
Data Scientist,Cleaning and preprocessing data for analysis,Partially
Data Scientist,Exploratory data analysis to uncover trends,Partially
Data Scientist,Building predictive models using machine learning,Partially
Data Scientist,Validating the accuracy of models,Partially
Data Scientist,Deploying machine learning models to production,Partially
Data Scientist,Writing scripts for data transformations,No
Data Scientist,Performing feature engineering to enhance datasets,Partially
Data Scientist,Handling missing or imbalanced data,Partially
Data Scientist,Creating dashboards for data visualization,Partially
Data Scientist,Collaborating with stakeholders to define data-driven solutions,No
Data Scientist,Communicating findings through reports and presentations,No
Data Scientist,Optimizing algorithms for better performance,Partially
Data Scientist,Implementing deep learning models,Partially
Data Scientist,Developing recommendation systems,Partially
Data Scientist,Performing statistical analysis for hypothesis testing,Partially
Data Scientist,Tracking and preventing model drift in production,Partially
Data Scientist,Analyzing user behavior for business insights,Partially
Data Scientist,Performing A/B testing for product improvements,Partially
Data Scientist,Using natural language processing for text analysis,Partially
Data Scientist,Collaborating with data engineers to create data pipelines,No
Data Scientist,Automating data workflows with Python or R,Partially
Data Scientist,Managing big data with distributed computing tools,Partially
Data Scientist,Performing anomaly detection on time-series data,Partially
Data Scientist,Documenting data analysis processes,No
Data Scientist,Building tools to automate repetitive analysis tasks,Partially
Data Scientist,Ensuring ethical usage of data in projects,No
Data Scientist,Evaluating third-party datasets for suitability,No
Data Scientist,Designing experiments to validate data models,No
Data Scientist,Presenting data-driven recommendations to decision-makers,No
UI/UX Designer,Conducting user research to understand user needs,No
UI/UX Designer,Creating user personas and scenarios,No
UI/UX Designer,Designing wireframes for web and mobile applications,Partially
UI/UX Designer,Creating interactive prototypes for usability testing,Partially
UI/UX Designer,Collaborating with stakeholders to define project goals,No
UI/UX Designer,Designing user flows and navigation structures,No
UI/UX Designer,Developing design systems and style guides,No
UI/UX Designer,Conducting usability testing sessions,No
UI/UX Designer,Analyzing feedback to refine designs,No
UI/UX Designer,Creating high-fidelity mockups,Partially
UI/UX Designer,Designing responsive layouts for different devices,Partially
UI/UX Designer,Ensuring designs are accessible and inclusive,No
UI/UX Designer,Collaborating with developers for design implementation,No
UI/UX Designer,Managing design tools and libraries,No
UI/UX Designer,Presenting design concepts to stakeholders,No
UI/UX Designer,Iterating on designs based on user feedback,No
UI/UX Designer,Developing visual assets for branding and marketing,Partially
UI/UX Designer,Creating animations for improved user interactions,Partially
UI/UX Designer,Designing intuitive onboarding experiences,No
UI/UX Designer,Performing competitor analysis for design improvements,No
UI/UX Designer,Conducting A/B testing for design variations,Partially
UI/UX Designer,Using heatmaps to analyze user behavior,Partially
UI/UX Designer,Optimizing design elements for performance,No
UI/UX Designer,Implementing feedback loops for continuous improvement,No
UI/UX Designer,Ensuring compliance with design guidelines,No
UI/UX Designer,Creating user journey maps,No
UI/UX Designer,Designing for localization and multi-language support,Partially
UI/UX Designer,Documenting design processes for team reference,No
UI/UX Designer,Keeping up with design trends and best practices,No
UI/UX Designer,Collaborating with product managers to align designs with business goals,No
Technical Support Engineer,Responding to customer inquiries via email or chat,Partially
Technical Support Engineer,Troubleshooting technical issues for customers,Partially
Technical Support Engineer,Logging and tracking support tickets,Partially
Technical Support Engineer,Escalating unresolved issues to higher-level teams,No
Technical Support Engineer,Providing step-by-step solutions for common problems,Partially
Technical Support Engineer,Documenting new issues and their resolutions,No
Technical Support Engineer,Testing customer-reported issues in test environments,No
Technical Support Engineer,Assisting with software installations and configurations,No
Technical Support Engineer,Creating and updating knowledge base articles,Partially
Technical Support Engineer,Monitoring system alerts and proactively addressing issues,Partially
Technical Support Engineer,Performing root cause analysis for recurring problems,No
Technical Support Engineer,Training customers on software usage,No
Technical Support Engineer,Collaborating with development teams to resolve bugs,No
Technical Support Engineer,Providing remote desktop support,Partially
Technical Support Engineer,Handling hardware-related troubleshooting,Partially
Technical Support Engineer,Ensuring timely follow-ups with customers,No
Technical Support Engineer,Analyzing logs to identify system issues,Partially
Technical Support Engineer,Documenting steps for resolving complex issues,No
Technical Support Engineer,Providing feedback to product teams based on customer issues,No
Technical Support Engineer,Assisting with network connectivity troubleshooting,Partially
Technical Support Engineer,Monitoring customer satisfaction scores,No
Technical Support Engineer,Conducting system health checks for customers,Partially
Technical Support Engineer,Managing user account issues and permissions,Partially
Technical Support Engineer,Setting up software for new users,No
Technical Support Engineer,Collaborating with IT teams for infrastructure issues,No
Technical Support Engineer,Providing insights into frequently reported issues,No
Technical Support Engineer,Testing software patches before release,Partially
Technical Support Engineer,Advising customers on best practices for software usage,No
Technical Support Engineer,Guiding customers through system upgrades,No
Technical Support Engineer,Maintaining detailed records of support interactions,Partially